{
  "schema_version": "1.0.0",
  "project": "ETF_SINGLE_ROTATION",
  "task_id": "ETF-DIV-004",
  "run_id": 39599580852,
  "run_attempt": 1,
  "github_event": "manual_external",
  "head_sha": "6b23db083817085d1ac88c82ade91befc2a23ae1",
  "status": "REVIEW_REQUIRED",
  "source": {
    "data_cutoff_utc": "2026-10-21T12:26:39Z",
    "input_sha256": "b873df69a4694bbe8a7ce78ff29ebbfd073aeed45946f280e285e003ca3265a4",
    "provenance": "Historical ETF one-shot GitHub Run 39599580852, actual checkout 6b23db08; independent stored-byte Drive readbacks across PR #92 comments 6430249389,6433404889,6435873053,6436764764,6437762247,6438834832 and this review. This manual_external receipt describes a later audit of that historical run, not a new GitHub workflow execution."
  },
  "checks": {
    "tests_passed": 0,
    "tests_failed": 0,
    "output_sha256": null
  },
  "artifact_urls": [
    "https://github.com/magangwwd/ashare-research-infra/actions/runs/39599580852"
  ],
  "drive_readback": {
    "performed": true,
    "matching_files": 48,
    "differences": 0
  },
  "next_action": "Stored-file byte integrity of all 48 distinct archived names reviewed (29 in prior PR #92 evidence including one previously omitted from count, 19 newly byte-hashed). Audit manifest ETF_DRIVE_39599580852_48of48_readback_20261028.json lists all 19 new full SHA256 digests. Still REVIEW_REQUIRED: independent issuer dividend completeness, raw market prices/fund_adj total-return, registered share/cash settlement and new DIV004 artifact/Drive write-readback not accepted. PAPER-005 stays BLOCKED; do not trade. Historical checkpoint was mid-upload; GitHub Run completed.",
  "created_at_utc": "2026-10-27T16:02:39.566Z",
  "risk_approval": "RESEARCH_ONLY",
  "blocker": "ETF-DIV-004 issuer event coverage, independent price/fund_adj and cash settlement not accepted; PR #92/#103 draft; data file integrity alone cannot unlock PAPER-005.",
  "fingerprint": "historical-run-39599580852-drive-48-distinct-sha256",
  "agent_review_id": "github-pr92-comments-6430249389-6433404889-6435873053-6436764764-6437762247-6438834832"
}
