{
  "schema_version": "1.0.0",
  "project": "ETF_SINGLE_ROTATION",
  "task_id": "ETF-DIV-004",
  "run_id": 40142597924,
  "run_attempt": 1,
  "github_event": "push",
  "head_sha": "c834f486778840f033e18d7486c16b566e69a220",
  "status": "REVIEW_REQUIRED",
  "source": {
    "data_cutoff_utc": null,
    "input_sha256": null,
    "provenance": "Synthetic offline dividend entitlement ledger tests only; no real market, issuer settlement, or account data"
  },
  "checks": {
    "tests_passed": 81,
    "tests_failed": 0,
    "output_sha256": null
  },
  "artifact_urls": [],
  "drive_readback": {
    "performed": false,
    "matching_files": 0,
    "differences": 0
  },
  "next_action": "Review PR #92 and 81-test CI; independently validate issuer dividend register, raw prices, registered units and broker cash dates, then real Artifact/Drive readback before DIV-004 acceptance. Keep PAPER-005 BLOCKED.",
  "created_at_utc": "2026-10-24T23:24:27Z",
  "risk_approval": "RESEARCH_ONLY",
  "blocker": "No independent price/actual cash entitlement evidence or new Drive readback; PR #92 is draft and not merged.",
  "fingerprint": null,
  "agent_review_id": null
}
