{
  "schema_version": "1.0.0",
  "project": "ETF_SINGLE_ROTATION",
  "task_id": "ETF-DIV-004",
  "run_id": 40193379602,
  "run_attempt": 1,
  "github_event": "push",
  "head_sha": "340e9cecee7fc9d3b25f4da235056568ebe07457",
  "status": "REVIEW_REQUIRED",
  "source": {
    "data_cutoff_utc": null,
    "input_sha256": null,
    "provenance": "Read-only synthetic 510300 candidate-vs-executable dividend registry coverage: detect registry-only cash events absent from secondary candidate list; no independent issuer data, market quotes or account settlement used."
  },
  "checks": {
    "tests_passed": 89,
    "tests_failed": 0,
    "output_sha256": null
  },
  "artifact_urls": [],
  "drive_readback": {
    "performed": false,
    "matching_files": 0,
    "differences": 0
  },
  "next_action": "Review draft PR #92 and #103; complete original issuer events for all eight ETFs, independent raw prices/fund_adj, registered units, actual spendable cash, Artifact and Drive write/readback. Keep PAPER-005 blocked.",
  "created_at_utc": "2026-10-25T12:30:37.095Z",
  "risk_approval": "RESEARCH_ONLY",
  "blocker": "Synthetic-only 89/89 tests; no new artifact, Drive readback, independent issuer completeness, market data or account cash settlement. No full ETF backtest. PR #92 unmerged; PAPER-005 dependency blocked.",
  "fingerprint": "etf-div004-bidirectional-candidate-coverage-340e9cecee7fc9d3b25f4da235056568ebe07457"
}
