{
  "schema_version": "1.0.0",
  "project": "ETF fixed-8 single-rotation research",
  "task_id": "ETF-DIV-004",
  "run_id": 39941628093,
  "run_attempt": 1,
  "github_event": "pull_request",
  "head_sha": "c008f66c7a31cbec8735cac9bd6a556d2bb76f7b",
  "status": "REVIEW_REQUIRED",
  "source": {
    "data_cutoff_utc": null,
    "input_sha256": null,
    "provenance": "Synthetic accounting fixtures only; issuer originals, raw prices and fund_adj NOT independently certified"
  },
  "checks": {
    "tests_passed": 44,
    "tests_failed": 0,
    "output_sha256": null
  },
  "artifact_urls": [],
  "drive_readback": {
    "performed": false,
    "matching_files": 0,
    "differences": 0
  },
  "next_action": "Reconcile issuer original notices, raw closes and fund_adj, actual record-date share positions and spendable cash dates; independently verify DIV004 artifact SHA and Drive write/readback before considering VERIFIED_DONE. PAPER-005 dependency remains blocked.",
  "created_at_utc": "2026-10-23T11:46:37Z",
  "risk_approval": "RESEARCH_ONLY",
  "blocker": "Synthetic CI success does not establish true event-window total return or independent Drive readback; ETF-DIV-004 remains REVIEW_REQUIRED.",
  "fingerprint": "scoped-ci:c008f66c7a31cbec8735cac9bd6a556d2bb76f7b:39941628093:1",
  "agent_review_id": "ETF-DIV-004-39941628093"
}
