{
  "schema_version": "1.0.0",
  "project": "ETF_SINGLE_ROTATION",
  "task_id": "ETF-DIV-004",
  "run_id": 40009159899,
  "run_attempt": 1,
  "github_event": "pull_request",
  "head_sha": "7da1f4b6dc043ebb24f651c888baf71de3cca2c1",
  "status": "REVIEW_REQUIRED",
  "source": {
    "data_cutoff_utc": null,
    "input_sha256": null,
    "provenance": "SSE primary-hosted 510300 2024-01-11 issuer notice (indexed PDF text read; PDF bytes/SHA not acquired). Historical Tushare price artifact was NOT re-downloaded during this scoped CI."
  },
  "checks": {
    "tests_passed": 60,
    "tests_failed": 0,
    "output_sha256": null
  },
  "artifact_urls": [],
  "drive_readback": {
    "performed": false,
    "matching_files": 0,
    "differences": 0
  },
  "next_action": "Review 510300 2024-01-11 primary issuer evidence and continue primary notices for 2019-2023; independently verify market prices and actual spendable cash before portfolio total-return acceptance. PAPER-005 remains blocked.",
  "created_at_utc": "2026-10-23T19:10:00Z",
  "risk_approval": "RESEARCH_ONLY",
  "blocker": "Issuer coverage, independent prices, account-level settlement and portfolio total-return still unverified; scoped CI has no Artifact or Drive upload.",
  "fingerprint": "ETF-DIV-004:510300:2024-01-11:SSE:7da1f4b6dc04",
  "agent_review_id": null
}
