{
  "schema_version": "1.0.0",
  "project": "ETF_SINGLE_ROTATION",
  "task_id": "ETF-DIV-004",
  "run_id": 40188944842,
  "run_attempt": 1,
  "github_event": "push",
  "head_sha": "e77f803fbcf60f96fb827bef81840f3f09202d2c",
  "status": "REVIEW_REQUIRED",
  "source": {
    "data_cutoff_utc": null,
    "input_sha256": null,
    "provenance": "Read-only secondary 510300.SH dividend candidate metadata (2019-2026) compared with the four-event corporate-action executable registry; no original issuer PDF or independent market prices fetched in this CI."
  },
  "checks": {
    "tests_passed": 88,
    "tests_failed": 0,
    "output_sha256": null
  },
  "artifact_urls": [],
  "drive_readback": {
    "performed": false,
    "matching_files": 0,
    "differences": 0
  },
  "next_action": "Review 8 missing 510300 candidate dividends against original issuer/exchange notices, verify other seven ETFs, independently reconcile prices/fund_adj and actual broker cash; then validate Artifact and Drive write/readback. PAPER-005 remains blocked. Review draft PR #92 and #103.",
  "created_at_utc": "2026-10-25T11:28:10.508Z",
  "risk_approval": "RESEARCH_ONLY",
  "blocker": "8 secondary 510300 dividend candidates absent from executable event registry; candidate source is not issuer proof. No independent price/settlement or new Artifact/Drive evidence; PR unmerged.",
  "fingerprint": "etf-div004-candidate-coverage-e77f803fbcf60f96fb827bef81840f3f09202d2c"
}
