{
  "schema_version": "1.0.0",
  "project": "ETF_SINGLE_ROTATION",
  "task_id": "ETF-DIV-004",
  "run_id": 40015203418,
  "run_attempt": 1,
  "github_event": "pull_request",
  "head_sha": "6856c7477b1c6486097b0a7a6d940672639d1198",
  "status": "REVIEW_REQUIRED",
  "source": {
    "data_cutoff_utc": null,
    "input_sha256": null,
    "provenance": "2023-01-09 SSE-hosted issuer 510300 primary dividend notice, 3-page text independently inspected; PDF bytes/SHA not acquired. Evidence path etf_single_rotation/metadata/510300_20230109_dividend_primary_sse_crosscheck.json. No new independent market data."
  },
  "checks": {
    "tests_passed": 60,
    "tests_failed": 0,
    "output_sha256": null
  },
  "artifact_urls": [],
  "drive_readback": {
    "performed": false,
    "matching_files": 0,
    "differences": 0
  },
  "next_action": "Obtain remaining 510300 2019/2021/2022 primary issuer notices, independent market raw close/fund_adj and portfolio share/cash settlement evidence, plus DIV004 Artifact/Drive readback. Do not start PAPER-005. Review draft SOP PR #98 to accept truthful pull_request receipts.",
  "created_at_utc": "2026-10-23T19:55:34Z",
  "risk_approval": "RESEARCH_ONLY",
  "blocker": "Primary event text confirms 2023 dividend and issuer/CSD transfer dates only; independent price accuracy, actual account spendable cash, portfolio total-return, artifact and Drive acceptance remain missing. Main v1.0.0 schema rejects truthful pull_request event until draft PR #98 accepted.",
  "fingerprint": "etf-div004:510300:2023-01-09:SSE:6856c7477b1c:40015203418",
  "agent_review_id": "ETF-DIV-004-510300-2023-40015203418"
}
